<?xml version='1.0' encoding='UTF-8'?>
<tweet_collection xmlns:xsi="http://www.w3.org/2001/XMLSchema-instance"
xsi:noNamespaceSchemaLocation="tweet_collection.xsd">
  <tweet>
    <Original_tweet>questa Ã¨ una prova </Original_tweet>
    <Translate_tweet>this is a test</Translate_tweet>
    <Sentiment_nostem>POSITIVE</Sentiment_nostem>
    <Sentiment_stem>POSITIVE</Sentiment_stem>
    <Expected>POSITIVE</Expected>
  </tweet>
  <Precision_recall>
    <POSITIVE>
      <Precision>100.0%</Precision>
      <Recall>100.0%</Recall>
    </POSITIVE>
    <POSITIVE_STEMMED>
      <Precision>100.0%</Precision>
      <Recall>100.0%</Recall>
    </POSITIVE_STEMMED>
  </Precision_recall>
</tweet_collection>
